{
  "question_id": "DAY_daily-examiner-01a0aa30_00001",
  "persona": {
    "person_id": "PERSON_00001",
    "name": "赵安宇",
    "synthetic": true,
    "age": 46,
    "gender": "男",
    "occupation": "农产品经营者",
    "city": "绵阳",
    "timezone": "Asia/Shanghai",
    "date": "2026-07-24",
    "day_start": "2026-07-24T00:00:00+08:00",
    "day_end_exclusive": "2026-07-25T00:00:00+08:00",
    "day_type": "本人的排班或任务日，不以自然周末推断休假",
    "household_context": "独居，家人异地",
    "interest": "看纪录片",
    "contacts": [
      {
        "name": "李博桐",
        "role": "采购联系人"
      },
      {
        "name": "杨可竹",
        "role": "朋友"
      },
      {
        "name": "张光乐",
        "role": "日常工作联系人"
      }
    ],
    "accounting_scope": "本题给出的人民币活期账户与个人借款本金，账本完整；不推断其他资产或第三人账户",
    "starting_context": {
      "task": "安排温室蔬菜供货",
      "deliverable": "供货计划",
      "cash_balance_cents": 2646900,
      "loan_principal_cents": 0
    }
  },
  "cleaned_daily_stream": [
    {
      "slice_id": "SL_00001_6737",
      "timestamp": "2026-07-24T00:00:00+08:00",
      "end_timestamp": "2026-07-24T07:00:00+08:00",
      "modality": "SENSOR",
      "speaker_or_source": "手环睡眠摘要",
      "location": "家中",
      "content": "夜间睡眠监测到晨起结束：有效睡眠443分钟，清醒27分钟；统计窗含前夜入睡部分。",
      "measurements": {
        "sleep_minutes": 443,
        "awake_minutes": 27,
        "measurement_start": "2026-07-23T23:10:00+08:00",
        "measurement_end": "2026-07-24T07:00:00+08:00"
      }
    },
    {
      "slice_id": "SL_00001_8204",
      "timestamp": "2026-07-24T07:05:00+08:00",
      "end_timestamp": "2026-07-24T07:06:00+08:00",
      "modality": "SENSOR",
      "speaker_or_source": "手环PPG摘要",
      "location": "家中",
      "content": "晨起静坐心率74bpm，测量接触有效，没有运动。",
      "measurements": {
        "heart_rate_bpm": 74,
        "motion": "seated",
        "signal_valid": true
      }
    },
    {
      "slice_id": "SL_00001_1965",
      "timestamp": "2026-07-24T07:12:00+08:00",
      "end_timestamp": "2026-07-24T07:13:00+08:00",
      "modality": "APP",
      "speaker_or_source": "银行日初快照",
      "location": "家中",
      "content": "本题账户日初余额26469.00元；个人借款本金0.00元。",
      "measurements": {
        "cash_balance_cents": 2646900,
        "loan_principal_cents": 0
      }
    },
    {
      "slice_id": "SL_00001_7395",
      "timestamp": "2026-07-24T07:15:00+08:00",
      "end_timestamp": "2026-07-24T07:16:00+08:00",
      "modality": "MIC",
      "speaker_or_source": "赵安宇",
      "location": "家中",
      "content": "群里有人分享周末电影，我只点开看了一眼。"
    },
    {
      "slice_id": "SL_00001_9926",
      "timestamp": "2026-07-24T07:19:00+08:00",
      "end_timestamp": "2026-07-24T07:20:00+08:00",
      "modality": "APP",
      "speaker_or_source": "个人备忘录",
      "location": "家中",
      "content": "群里有人分享社区旧物修复，我只点开看了一眼。"
    },
    {
      "slice_id": "SL_00001_7947",
      "timestamp": "2026-07-24T07:23:00+08:00",
      "end_timestamp": "2026-07-24T07:24:00+08:00",
      "modality": "MIC",
      "speaker_or_source": "赵安宇",
      "location": "家中",
      "content": "群里有人分享宠物领养，我只点开看了一眼。"
    },
    {
      "slice_id": "SL_00001_7157",
      "timestamp": "2026-07-24T07:27:00+08:00",
      "end_timestamp": "2026-07-24T07:28:00+08:00",
      "modality": "APP",
      "speaker_or_source": "个人备忘录",
      "location": "家中",
      "content": "家人问今天几点回，我说要看安排，有变化再联系。"
    },
    {
      "slice_id": "SL_00001_1856",
      "timestamp": "2026-07-24T07:31:00+08:00",
      "end_timestamp": "2026-07-24T07:32:00+08:00",
      "modality": "APP",
      "speaker_or_source": "个人备忘录",
      "location": "家中",
      "content": "我把门卡放回原处，出门前再检查一遍。"
    },
    {
      "slice_id": "SL_00001_2534",
      "timestamp": "2026-07-24T07:39:00+08:00",
      "end_timestamp": "2026-07-24T07:40:00+08:00",
      "modality": "APP",
      "speaker_or_source": "已清洗通知摘要",
      "location": "家中",
      "content": "家人问今天几点回，我说要看安排，有变化再联系。"
    },
    {
      "slice_id": "SL_00001_9495",
      "timestamp": "2026-07-24T07:43:00+08:00",
      "end_timestamp": "2026-07-24T07:44:00+08:00",
      "modality": "USER_NOTE",
      "speaker_or_source": "赵安宇",
      "location": "家中",
      "content": "天气预报说本市多云，我带了折叠伞。"
    },
    {
      "slice_id": "SL_00001_5919",
      "timestamp": "2026-07-24T07:47:00+08:00",
      "end_timestamp": "2026-07-24T07:48:00+08:00",
      "modality": "APP",
      "speaker_or_source": "已清洗通知摘要",
      "location": "家中",
      "content": "出门前核对门锁，钥匙放在外袋。"
    },
    {
      "slice_id": "SL_00001_4962",
      "timestamp": "2026-07-24T07:51:00+08:00",
      "end_timestamp": "2026-07-24T07:52:00+08:00",
      "modality": "MIC",
      "speaker_or_source": "赵安宇",
      "location": "家中",
      "content": "日历提醒整理蓝色文件夹，这只是普通提醒，没有新增工作承诺。"
    },
    {
      "slice_id": "SL_00001_1263",
      "timestamp": "2026-07-24T07:55:00+08:00",
      "end_timestamp": "2026-07-24T07:56:00+08:00",
      "modality": "APP",
      "speaker_or_source": "个人账户银行已入账回执",
      "location": "家中",
      "content": "早餐支付成功，扣款18.00元，此条为实际交易而非优惠宣传。",
      "transaction": {
        "transaction_id": "TX_00001_01",
        "amount_cents": -1800,
        "currency": "CNY",
        "status": "SETTLED",
        "category": "ordinary_expense"
      }
    },
    {
      "slice_id": "SL_00001_2802",
      "timestamp": "2026-07-24T07:59:00+08:00",
      "end_timestamp": "2026-07-24T08:00:00+08:00",
      "modality": "MIC",
      "speaker_or_source": "赵安宇",
      "location": "家中",
      "content": "日历提醒整理蓝色文件夹，这只是普通提醒，没有新增工作承诺。"
    },
    {
      "slice_id": "SL_00001_7513",
      "timestamp": "2026-07-24T08:03:00+08:00",
      "end_timestamp": "2026-07-24T08:04:00+08:00",
      "modality": "USER_NOTE",
      "speaker_or_source": "赵安宇",
      "location": "通勤路线",
      "content": "日历提醒整理水杯，这只是普通提醒，没有新增工作承诺。"
    },
    {
      "slice_id": "SL_00001_5295",
      "timestamp": "2026-07-24T08:07:00+08:00",
      "end_timestamp": "2026-07-24T08:08:00+08:00",
      "modality": "MIC",
      "speaker_or_source": "赵安宇",
      "location": "通勤路线",
      "content": "日历提醒整理充电线，这只是普通提醒，没有新增工作承诺。"
    },
    {
      "slice_id": "SL_00001_9489",
      "timestamp": "2026-07-24T08:11:00+08:00",
      "end_timestamp": "2026-07-24T08:12:00+08:00",
      "modality": "APP",
      "speaker_or_source": "个人备忘录",
      "location": "通勤路线",
      "content": "家人问今天几点回，我说要看安排，有变化再联系。"
    },
    {
      "slice_id": "SL_00001_5965",
      "timestamp": "2026-07-24T08:15:00+08:00",
      "end_timestamp": "2026-07-24T08:16:00+08:00",
      "modality": "APP",
      "speaker_or_source": "个人备忘录",
      "location": "通勤路线",
      "content": "早餐后看了两页科普小册子，先不继续看了。"
    },
    {
      "slice_id": "SL_00001_2096",
      "timestamp": "2026-07-24T08:19:00+08:00",
      "end_timestamp": "2026-07-24T08:20:00+08:00",
      "modality": "APP",
      "speaker_or_source": "已清洗通知摘要",
      "location": "通勤路线",
      "content": "群里有人分享周末电影，我只点开看了一眼。"
    },
    {
      "slice_id": "SL_00001_9227",
      "timestamp": "2026-07-24T08:31:00+08:00",
      "end_timestamp": "2026-07-24T08:32:00+08:00",
      "modality": "MIC",
      "speaker_or_source": "赵安宇",
      "location": "通勤路线",
      "content": "早餐后看了两页地方风物志，先不继续看了。"
    },
    {
      "slice_id": "SL_00001_4064",
      "timestamp": "2026-07-24T08:35:00+08:00",
      "end_timestamp": "2026-07-24T08:36:00+08:00",
      "modality": "APP",
      "speaker_or_source": "日常消息摘要",
      "location": "通勤路线",
      "content": "出门前核对门锁，钥匙放在外袋。"
    },
    {
      "slice_id": "SL_00001_5373",
      "timestamp": "2026-07-24T08:39:00+08:00",
      "end_timestamp": "2026-07-24T08:40:00+08:00",
      "modality": "MIC",
      "speaker_or_source": "赵安宇",
      "location": "通勤路线",
      "content": "早餐后看了两页科普小册子，先不继续看了。"
    },
    {
      "slice_id": "SL_00001_2401",
      "timestamp": "2026-07-24T08:43:00+08:00",
      "end_timestamp": "2026-07-24T08:44:00+08:00",
      "modality": "USER_NOTE",
      "speaker_or_source": "赵安宇",
      "location": "通勤路线",
      "content": "早餐后看了两页建筑速写集，先不继续看了。"
    },
    {
      "slice_id": "SL_00001_9025",
      "timestamp": "2026-07-24T08:47:00+08:00",
      "end_timestamp": "2026-07-24T08:48:00+08:00",
      "modality": "APP",
      "speaker_or_source": "个人备忘录",
      "location": "通勤路线",
      "content": "早餐后看了两页烹饪笔记，先不继续看了。"
    },
    {
      "slice_id": "SL_00001_9519",
      "timestamp": "2026-07-24T08:51:00+08:00",
      "end_timestamp": "2026-07-24T08:52:00+08:00",
      "modality": "APP",
      "speaker_or_source": "个人备忘录",
      "location": "通勤路线",
      "content": "早餐后看了两页摄影入门书，先不继续看了。"
    },
    {
      "slice_id": "SL_00001_9140",
      "timestamp": "2026-07-24T08:55:00+08:00",
      "end_timestamp": "2026-07-24T08:56:00+08:00",
      "modality": "MIC",
      "speaker_or_source": "赵安宇",
      "location": "通勤路线",
      "content": "群里有人分享宠物领养，我只点开看了一眼。"
    },
    {
      "slice_id": "SL_00001_3392",
      "timestamp": "2026-07-24T09:03:00+08:00",
      "end_timestamp": "2026-07-24T09:04:00+08:00",
      "modality": "MIC",
      "speaker_or_source": "赵安宇",
      "location": "合作社办公室",
      "content": "同事问耳机盒放在哪，我指了指共享柜。"
    },
    {
      "slice_id": "SL_00001_2669",
      "timestamp": "2026-07-24T09:11:00+08:00",
      "end_timestamp": "2026-07-24T09:12:00+08:00",
      "modality": "USER_NOTE",
      "speaker_or_source": "赵安宇",
      "location": "合作社办公室",
      "content": "群里转发某地公司裁员新闻，明确不是本人的工作通知。"
    },
    {
      "slice_id": "SL_00001_4472",
      "timestamp": "2026-07-24T09:19:00+08:00",
      "end_timestamp": "2026-07-24T09:20:00+08:00",
      "modality": "USER_NOTE",
      "speaker_or_source": "赵安宇",
      "location": "合作社办公室",
      "content": "公共日历推送例行系统维护提醒，没有改变个人任务时限。"
    },
    {
      "slice_id": "SL_00001_8317",
      "timestamp": "2026-07-24T09:23:00+08:00",
      "end_timestamp": "2026-07-24T09:24:00+08:00",
      "modality": "APP",
      "speaker_or_source": "个人备忘录",
      "location": "合作社办公室",
      "content": "接了温水，站在窗边活动肩颈一分钟。"
    },
    {
      "slice_id": "SL_00001_3812",